### ISSUE TITLE
Freo X Plus

### ISSUE THREAD

**Issue by encrust-ace** [sjmotew/NarwalIntegration#3]
I've freo X Plus model, I'm unable to add the device.

Downloaded latest version using HACS,
giving correct IP and port kept default but getting below error

<img width="1080" height="2400" alt="Image" src="https://github.com/user-attachments/assets/fef9697b-4403-40ca-b09d-4f4bccd1f140" />

**Comment by encrust-ace** [comment]
I tried all the above methods, port 9002 is closed.
I trid to scan the ports, and most of the ports I am not aware what are those, looked like mqtt, so I did below things.

- Created hotspot in laptop. and provided internet to laptop using a phone's ethernet hotspot.
- Connected the robot and the phone which have narwal app installed with my laptop's hotspot.
- Robot ID: 10.42.0.10
- Phone IP: 10.42.0.224
- Ran below command
- `sudo tcpdump -i wlo1 -c 10
dropped privs to tcpdump
tcpdump: verbose output suppressed, use -v[v]... for full protocol decode
listening on wlo1, link-type EN10MB (Ethernet), snapshot length 262144 bytes
12:13:25.901232 IP 10.42.0.224.52484 > fedora.domain: 43600+ A? iphone-ld.apple.com. (37)
12:13:25.901264 IP 10.42.0.224.56598 > fedora.domain: 24505+ HTTPS? iphone-ld.apple.com. (37)
12:13:25.901268 IP 10.42.0.224.58564 > 17.242.13.4.hpvirtgrp: Flags [P.], seq 3530347867:3530347907, ack 2905868219, win 2048, options [nop,nop,TS val 2897205710 ecr 3098100627], length 40
12:13:25.901268 IP 10.42.0.224.58564 > 17.242.13.4.hpvirtgrp: Flags [P.], seq 0:40, ack 1, win 2048, options [nop,nop,TS val 2897205876 ecr 3098100627], length 40
12:13:25.977686 IP fedora.domain > 10.42.0.224.52484: 43600 5/4/8 CNAME iphone-ld.origin-apple.com.akadns.net., CNAME iphone-ld-migration.origin-apple.com.akadns.net., CNAME iphone-ld.v.aaplimg.com., A 17.253.18.199, A 17.253.18.195 (435)
12:13:25.987821 IP 17.242.13.4.hpvirtgrp > 10.42.0.224.58564: Flags [P.], seq 1:25, ack 40, win 249, options [nop,nop,TS val 3098208406 ecr 2897205710], length 24
12:13:25.987835 IP 17.242.13.4.hpvirtgrp > 10.42.0.224.58564: Flags [.], ack 40, win 249, options [nop,nop,TS val 3098208406 ecr 2897205876,nop,nop,sack 1 {0:40}], length 0
12:13:26.002858 IP fedora.domain > 10.42.0.224.56598: 24505 3/1/0 CNAME iphone-ld.origin-apple.com.akadns.net., CNAME iphone-ld-migration.origin-apple.com.akadns.net., CNAME iphone-ld.v.aaplimg.com. (210)
12:13:26.059377 IP 10.42.0.224.58564 > 17.242.13.4.hpvirtgrp: Flags [.], ack 25, win 2048, options [nop,nop,TS val 2897206036 ecr 3098208406], length 0
12:13:26.061161 IP 10.42.0.224.50638 > fedora.domain: 35998+ HTTPS? iphone-ld.v.aaplimg.com. (41)
10 packets captured
26 packets received by filter
0 packets dropped by kernel
`

from this I can see its mqtt to cloud is happening.
then I decided to capture more data using

sudo tcpdump -i wlo1 -nn -w test_local_control.pcap

I used wireshark to analyse the data and found below

filter:
ip.src == 10.42.0.224 && ip.dst == 10.42.0.10
No data found

filet:
tcp.port == 8883 || tcp.port == 1883

10.42.0.10 is present in source and with it target is always 47.57.191.50 with protocol mostly TCP and sometimes TLS

and when  10.42.0.10 is detination then source is 47.57.191.50 and protocols are same mostlt TCP and sometimes TLS

Filter:
udp && (ip.addr == 10.42.0.10) filter and I can see

10.42.0.10 as source and 10.42.0.1 as destination with protcol DNS and one time DHCP
and same opposite too.

with all this the conclusion is

Phone App ──TLS/MQTT──▶ Narwal Cloud ◀──TLS/MQTT── Robot

**Comment by encrust-ace** [comment]
[https://drive.google.com/file/d/1OzatWkhV8FfGdAFktnYENKGHJJXS4Pmb/view?usp=sharing](url)

I have attched the packet monitoring file if you want to dig more into it.

I but I don't think local communication will be possible easily. (I have limited knowledge)
